title,link,company,summary
Graduate C# Software Engineer,https://www.seek.com.au/job/39077496?type=standard&searchrequesttoken=0ac638ab-d61a-40aa-a997-b2927688e90a,en world Australia,"New opening for graduate C# software engineer with sockets / multithreading / SQL skills. Work with industrial robots, wireless, M2M technologies.​"
Software Engineer,https://www.seek.com.au/job/39088264?type=standard&searchrequesttoken=0ac638ab-d61a-40aa-a997-b2927688e90a,Chandler Macleod Group,"Work with the latest, cutting-edge technologies with this international Client! Seeking C++ Software Engineers to be based out of the Brisbane CBD."
Graduate Software Engineer,https://www.seek.com.au/job/39083985?type=standard&searchrequesttoken=0ac638ab-d61a-40aa-a997-b2927688e90a,Robert Walters,Looking for a Graduate Software Engineer to join a top tier global bank to help with the automation of their IT operations and systems.
Graduate Software Engineer,https://www.seek.com.au/job/39007615?type=standard&searchrequesttoken=0ac638ab-d61a-40aa-a997-b2927688e90a,Robert Walters,Robert Walters have partnered exclusively with a well established and global software organisation to recruit an additional graduate software engineer
Software Engineer,https://www.seek.com.au/job/39067865?type=standout&searchrequesttoken=0ac638ab-d61a-40aa-a997-b2927688e90a,The Onset,"Take advantage of the career progression, stability and complex work as you design and develop Naval simulators in C++."
